{
  "type": "object",
  "required": [
    "jsonrpc",
    "method",
    "params"
  ],
  "additionalProperties": false,
  "definitions": {
    "requestInteger": {
      "type": "integer",
      "minimum": 0,
      "maximum": 9007199254740991,
      "description": "An exact JSON integer in [0, 2^53-1], the range every JSON client represents exactly."
    }
  },
  "properties": {
    "jsonrpc": {
      "enum": [
        "2.0"
      ]
    },
    "id": {
      "type": [
        "string",
        "integer",
        "null"
      ],
      "maxLength": 128,
      "minimum": -4294967295,
      "maximum": 4294967295
    },
    "method": {
      "enum": [
        "query.execute"
      ]
    },
    "params": {
      "type": "object",
      "required": [
        "query"
      ],
      "additionalProperties": false,
      "properties": {
        "query": {
          "type": "string",
          "minLength": 1,
          "description": "UTF-8 SQL; runtime enforces the configured byte limit (default 16384)."
        },
        "limit": {
          "$ref": "#/definitions/requestInteger",
          "description": "Maximum rows in this page, combined with an SQL LIMIT by taking the smaller; 0 returns no rows. A page above query-max-result-rows fails with QUERY_LIMIT."
        },
        "offset": {
          "$ref": "#/definitions/requestInteger",
          "description": "Rows of the complete, ordered output skipped before the page; beyond the end yields an empty page."
        },
        "timeout_ms": {
          "allOf": [
            {
              "$ref": "#/definitions/requestInteger"
            }
          ],
          "minimum": 1,
          "description": "Request deadline in milliseconds, counted from ingress; may only lower the configured query-timeout-ms (a larger value is INVALID_PARAMS)."
        }
      }
    }
  },
  "$schema": "http://json-schema.org/draft-04/schema#",
  "title": "WIRE query.execute single-request profile v1.1"
}
